<?xml version="1.0" encoding="UTF-8" ?>
<spaceships xmlns="http://games.smeanox.com"
            xmlns:xsi="http://www.w3.org/2001/XMLSchema-instance"
            xsi:schemaLocation="http://games.smeanox.com spaceships.xsd">
    <spaceship key="small">
        <texture id="spaceships" x="0" y="0" width="10" height="10"/>
        <properties capacity="10" propellant="1" speed="1" buildTime="5"/>
    </spaceship>
    <spaceship key="medium">
        <texture id="spaceships" x="0" y="0" width="10" height="10"/>
        <properties capacity="10" propellant="1" speed="1" buildTime="5"/>
    </spaceship>
    <spaceship key="big">
        <texture id="spaceships" x="0" y="0" width="10" height="10"/>
        <properties capacity="10" propellant="1" speed="1" buildTime="5"/>
    </spaceship>
    <spaceship key="giant">
        <texture id="spaceships" x="0" y="0" width="10" height="10"/>
        <properties capacity="10" propellant="1" speed="1" buildTime="5"/>
    </spaceship>
</spaceships>